{
  "tenant_id": "tenant-alpha",
  "manifest_id": "urn:cognous:manifest:synthetic-refund-v1",
  "manifest_version": "1.1",
  "manifest_digest": "sha256:4d1ad6c96bc242c63998231b4df3ad7c86dc2e5e59cdae63afe7bff86e60f6ac",
  "actor": "urn:cognous:actor:synthetic-refund-agent",
  "principal": "urn:cognous:principal:synthetic-customer-service",
  "action_id": "urn:cognous:action:refund-issue-routine-v1",
  "adapter_id": "urn:cognous:adapter:synthetic-refund-v1",
  "target": "urn:cognous:synthetic-account:customer-001",
  "payload": {
    "customer_id": "customer-001",
    "refund_reason": "duplicate charge"
  },
  "payload_commitment": "sha256:0b7db18bc64046f467d351c6016cc7c52c223dc77752f0d6e05889a8a43630e9",
  "requested_permissions": [
    "refund.issue.routine"
  ],
  "amount": 50,
  "unit": "USD",
  "effects": 1,
  "authority_context_ref": "urn:cognous:alvorada:public-stack-profile:0.1.0",
  "requirement_id": "urn:cognous:authority-requirement:refund-routine-v1",
  "risk_metadata": {
    "consequence_tier": "T1"
  },
  "not_before": "2026-10-05T00:00:00Z",
  "expires_at": "2026-10-06T00:00:00Z",
  "correlation_id": "corr-001",
  "run_id": "run-001",
  "expected_side_effects": [
    "synthetic_refund_record_created"
  ],
  "evidence_refs": [
    "urn:cognous:evidence:refund-entitlement"
  ]
}
